<?xml version="1.0" encoding="UTF-8" ?>
<!DOCTYPE mapper
       PUBLIC "-//mybatis.org//DTD Mapper 3.0//EN"
       "http://mybatis.org/dtd/mybatis-3-mapper.dtd">

<mapper namespace="kr.re.etri.uprep">
	
	<select id="SELECT_AUTH_USER" parameterType="hashmap" resultType="hashmap">
		SELECT  OVERLAY_NETWORK_ID,                                        
		        USER_ID,
		        UPDATED_AT
		FROM     
				uprep_auth_users
		<where>
			<trim prefixOverrides="AND">
				<if test="OVERLAY_NETWORK_ID != null">
					AND OVERLAY_NETWORK_ID = #{OVERLAY_NETWORK_ID}
				</if>
				<if test="USER_ID != null">
					AND USER_ID = #{USER_ID}
				</if>
			</trim>
		</where>
	</select>
	
	<insert id="INSERT_AUTH_USER" parameterType="hashmap">
		INSERT INTO uprep_auth_users
			<trim prefix="(" prefixOverrides="" suffix=")" suffixOverrides=",">
		        OVERLAY_NETWORK_ID,
	   			USER_ID,
	   			UPDATED_AT                                       
			</trim>
		VALUES
			<trim prefix="(" prefixOverrides="" suffix=")" suffixOverrides=",">
	   			#{OVERLAY_NETWORK_ID},                                        
		        #{USER_ID},
		        now()
			</trim>
		ON 
			DUPLICATE KEY 
		UPDATE
			UPDATED_AT = now()
	</insert>
	
	<delete id="DELETE_AUTH_USER" parameterType="hashmap" >
		DELETE FROM 
			uprep_auth_users 
		<where>
			<trim prefixOverrides="AND">
				<if test="OVERLAY_NETWORK_ID != null">
					AND OVERLAY_NETWORK_ID = #{OVERLAY_NETWORK_ID}
				</if>
				<if test="USER_ID != null">
					AND USER_ID = #{USER_ID}
				</if>
			</trim>
		</where>
	</delete>
	
	<delete id="DELETE_ALL_AUTH_USER" parameterType="hashmap" >
		DELETE FROM 
			uprep_auth_users 
		<where>
			<if test="OVERLAY_ID_LIST != null">
			OVERLAY_NETWORK_ID IN
				<foreach collection="OVERLAY_ID_LIST" item="item" separator="," open="(" close=")">
				    #{item}
				</foreach>
			</if>
		</where>
	</delete>
	
</mapper>