<?xml version="1.0" encoding="UTF-8" ?>
<!DOCTYPE mapper
       PUBLIC "-//mybatis.org//DTD Mapper 3.0//EN"
       "http://mybatis.org/dtd/mybatis-3-mapper.dtd">

<mapper namespace="kr.re.etri.uprep">
	
	<select id="SELECT_RESERVATION" parameterType="hashmap" resultType="hashmap">
		SELECT  VIRTUAL_PEER_ID,
		        REQUESTER_PEER_ID,
				OVERLAY_NETWORK_ID,
				RESOURCE_ID,
		        INDEX_URL,
		        OMS_ADDRESS,
		        PIECE_SIZE,
		        ACTION_TYPE,
		        STORAGE_SIZE,
	   			MAX_UP_BW,
	   			MAX_DN_BW,
	   			MAX_NUM_CONNECTION,
	   			TIMEOUT,
	   			MAX_TRAFFIC,
	   			NUM_OF_SEEDER,
	   			COMPLETED,
	   			EXPIRES,
	   			NETWORK_IP,
	   			NETWORK_PORT,
	   			LINK,
		        DATE_FORMAT(CREATED_AT, '%Y-%m-%d %H:%i:%s') CREATED_AT,
		        DATE_FORMAT(UPDATED_AT, '%Y-%m-%d %H:%i:%s') UPDATED_AT                                  
		FROM     
				uprep_cache_server_reservation
		<where>
			<trim prefixOverrides="AND">
				<if test="VIRTUAL_PEER_ID != null">
					AND VIRTUAL_PEER_ID = #{VIRTUAL_PEER_ID}
				</if>
				<if test="OVERLAY_NETWORK_ID != null">
					AND OVERLAY_NETWORK_ID = #{OVERLAY_NETWORK_ID}
				</if>
				<if test="REQUESTER_PEER_ID != null">
					AND REQUESTER_PEER_ID = #{REQUESTER_PEER_ID}
				</if>
				<if test="RESOURCE_ID != null">
					AND RESOURCE_ID = #{RESOURCE_ID}
				</if>
				<if test="CS_URL != null">
					AND RESOURCE_ID IN
					(SELECT RESOURCE_ID FROM uprep_cache_server_registration WHERE CS_URL LIKE CONCAT('%',#{CS_URL},'%'))
				</if>
				<!-- <if test="RESOURCE_ID_LIST != null">
					AND RESOURCE_ID IN
					<foreach collection="RESOURCE_ID_LIST" item="item" separator="," open="(" close=")">
					    #{item}
					</foreach>
				</if> -->
			</trim>
		</where>
	</select>
	
	<select id="SELECT_LAST_INSERT_RESERVATION_ID" parameterType="hashmap" resultType="hashmap">
		SELECT  
				VIRTUAL_PEER_ID
		FROM     
				uprep_cache_server_reservation
		ORDER BY 
				CREATED_AT DESC 
		LIMIT 1
	</select>
	
	<insert id="INSERT_RESERVATION" parameterType="hashmap">
		INSERT INTO uprep_cache_server_reservation
			<trim prefix="(" prefixOverrides="" suffix=")" suffixOverrides=",">
				VIRTUAL_PEER_ID,
		        REQUESTER_PEER_ID,
				OVERLAY_NETWORK_ID,
				<if test="RESOURCE_ID != null">RESOURCE_ID,</if>
		        INDEX_URL,
		        <if test="OMS_ADDRESS != null">OMS_ADDRESS,</if>
		        PIECE_SIZE,
		        ACTION_TYPE,
		        <if test="STORAGE_SIZE != null">STORAGE_SIZE,</if>
	   			<if test="MAX_UP_BW != null">MAX_UP_BW,</if>
	   			<if test="MAX_DN_BW != null">MAX_DN_BW,</if>
	   			<if test="MAX_NUM_CONNECTION != null">MAX_NUM_CONNECTION,</if>
	   			<if test="TIMEOUT != null">TIMEOUT,</if>
	   			<if test="MAX_TRAFFIC != null">MAX_TRAFFIC,</if>
	   			<if test="NUM_OF_SEEDER != null">NUM_OF_SEEDER,</if>
	   			<if test="COMPLETED != null">COMPLETED,</if>
	   			<if test="EXPIRES != null">EXPIRES,</if>
	   			<if test="NETWORK_IP != null">NETWORK_IP,</if>
	   			<if test="NETWORK_PORT != null">NETWORK_PORT,</if>
	   			<if test="LINK != null">LINK,</if>
		        CREATED_AT
			</trim>
		VALUES
			<trim prefix="(" prefixOverrides="" suffix=")" suffixOverrides=",">
		        #{VIRTUAL_PEER_ID},
		        #{REQUESTER_PEER_ID},
				#{OVERLAY_NETWORK_ID},
				<if test="RESOURCE_ID != null">#{RESOURCE_ID},</if>
		        #{INDEX_URL},
		        <if test="OMS_ADDRESS != null">#{OMS_ADDRESS},</if>
		        #{PIECE_SIZE},
		        #{ACTION_TYPE},
		        <if test="STORAGE_SIZE != null">#{STORAGE_SIZE},</if>
	   			<if test="MAX_UP_BW != null">#{MAX_UP_BW},</if>
	   			<if test="MAX_DN_BW != null">#{MAX_DN_BW},</if>
	   			<if test="MAX_NUM_CONNECTION != null">#{MAX_NUM_CONNECTION},</if>
	   			<if test="TIMEOUT != null">#{TIMEOUT},</if>
	   			<if test="MAX_TRAFFIC != null">#{MAX_TRAFFIC},</if>
	   			<if test="NUM_OF_SEEDER != null">#{NUM_OF_SEEDER},</if>
	   			<if test="COMPLETED != null">#{COMPLETED},</if>
	   			<if test="EXPIRES != null">#{EXPIRES},</if>
	   			<if test="NETWORK_IP != null">#{NETWORK_IP},</if>
	   			<if test="NETWORK_PORT != null">#{NETWORK_PORT},</if>
	   			<if test="LINK != null">#{LINK},</if>
		        now()
			</trim>
	</insert>
	
	<update id ="UPDATE_RESERVATION" parameterType="hashmap">
		UPDATE uprep_cache_server_reservation
		SET    
			<if test="STORAGE_SIZE != null"> STORAGE_SIZE = #{STORAGE_SIZE} ,</if> 
			<if test="STORAGE_SIZE != null"> MAX_UP_BW = #{MAX_UP_BW} ,</if>
			<if test="STORAGE_SIZE != null"> MAX_DN_BW = #{MAX_DN_BW} ,</if>
			<if test="STORAGE_SIZE != null"> MAX_NUM_CONNECTION = #{MAX_NUM_CONNECTION} ,</if>
			<if test="STORAGE_SIZE != null"> TIMEOUT = #{TIMEOUT},</if>
	   		<if test="STORAGE_SIZE != null"> MAX_TRAFFIC = #{MAX_TRAFFIC},</if>
	   		<if test="NUM_OF_SEEDER != null"> NUM_OF_SEEDER = #{NUM_OF_SEEDER},</if> 
	   		<if test="COMPLETED != null"> COMPLETED = #{COMPLETED},</if> 
			UPDATED_AT = now()
		WHERE  
			VIRTUAL_PEER_ID = #{VIRTUAL_PEER_ID}
	</update>
	
	<delete id="DELETE_RESERVATION" parameterType="hashmap" >
		DELETE FROM 
			uprep_cache_server_reservation
		<where>
			<trim prefixOverrides="AND">
				<if test="VIRTUAL_PEER_ID != null">
					AND VIRTUAL_PEER_ID = #{VIRTUAL_PEER_ID}
				</if>
				<if test="OVERLAY_NETWORK_ID != null">
					AND OVERLAY_NETWORK_ID = #{OVERLAY_NETWORK_ID}
				</if>
				<if test="REQUESTER_PEER_ID != null">
					AND REQUESTER_PEER_ID = #{REQUESTER_PEER_ID}
				</if>
				<if test="RESOURCE_ID != null">
					AND RESOURCE_ID = #{RESOURCE_ID}
				</if>
			</trim>
		</where> 
	</delete>
	
</mapper>