<?xml version="1.0" encoding="UTF-8" ?>
<!DOCTYPE mapper
       PUBLIC "-//mybatis.org//DTD Mapper 3.0//EN"
       "http://mybatis.org/dtd/mybatis-3-mapper.dtd">

<mapper namespace="kr.re.etri.uprep">
	
	<select id="SELECT_REGISTRATION" parameterType="hashmap" resultType="hashmap">
		SELECT  RESOURCE_ID,
				CS_URL,
				OMS_URL,
	   			TYPE,                                        
		        IP_ADDRESS,
		        PORT,
		        EXPIRES,
		        STORAGE_SIZE,
		        MAX_UP_BW,
	            MAX_DN_BW,
		        MAX_NUM_CONNECTION,
		        MAX_NUM_OVERLAY_NETWORK,
		        DATE_FORMAT(CREATED_AT, '%Y-%m-%d %H:%i:%s') CREATED_AT,
		        DATE_FORMAT(UPDATED_AT, '%Y-%m-%d %H:%i:%s') UPDATED_AT                                  
		FROM     
				uprep_cache_server_registration
		<where>
			<trim prefixOverrides="AND">
				<if test="RESOURCE_ID != null">
					AND RESOURCE_ID = #{RESOURCE_ID}
				</if>
				<if test="TYPE != null">
					AND TYPE = #{TYPE}
				</if>
				<if test="OMS_URL != null">
					AND OMS_URL LIKE CONCAT('%',#{OMS_URL},'%')
				</if>
				<if test="CS_URL != null">
					AND CS_URL LIKE CONCAT('%',#{CS_URL},'%')
				</if>
			</trim>
		</where>
	</select>
	
	<insert id="INSERT_REGISTRATION" parameterType="hashmap">
		INSERT INTO uprep_cache_server_registration
			<trim prefix="(" prefixOverrides="" suffix=")" suffixOverrides=",">
		        RESOURCE_ID,
		        <if test="CS_URL != null">CS_URL,</if>
		        OMS_URL,
	   			TYPE,                                        
		        <if test="IP_ADDRESS != null">IP_ADDRESS,</if>
		        <if test="PORT != null">PORT,</if>
		        <if test="EXPIRES != null">EXPIRES,</if>
		        <if test="STORAGE_SIZE != null">STORAGE_SIZE,</if>
		        MAX_UP_BW,
	            MAX_DN_BW,
		        MAX_NUM_CONNECTION,
		        MAX_NUM_OVERLAY_NETWORK,
		        CREATED_AT
			</trim>
		VALUES
			<trim prefix="(" prefixOverrides="" suffix=")" suffixOverrides=",">
		        #{RESOURCE_ID},
		        <if test="CS_URL != null">#{CS_URL},</if>
		        #{OMS_URL},
	   			#{TYPE},                                        
		        <if test="IP_ADDRESS != null">#{IP_ADDRESS},</if>
		        <if test="PORT != null">#{PORT},</if>
		        <if test="EXPIRES != null">#{EXPIRES},</if>
		        <if test="STORAGE_SIZE != null">#{STORAGE_SIZE},</if>
		        #{MAX_UP_BW},
	            #{MAX_DN_BW},
		        #{MAX_NUM_CONNECTION},
		        #{MAX_NUM_OVERLAY_NETWORK},
		        now()
			</trim>
		ON 
			DUPLICATE KEY 
		UPDATE
			TYPE = #{TYPE} , 
			EXPIRES = #{EXPIRES} ,
			<if test="STORAGE_SIZE != null"> STORAGE_SIZE = #{STORAGE_SIZE} ,</if> 
			MAX_UP_BW = #{MAX_UP_BW} ,
			MAX_DN_BW = #{MAX_DN_BW} ,
			MAX_NUM_CONNECTION = #{MAX_NUM_CONNECTION} ,
			MAX_NUM_OVERLAY_NETWORK = #{MAX_NUM_OVERLAY_NETWORK} ,
			UPDATED_AT = now()
	</insert>
	
	<update id ="UPDATE_REGISTRATION" parameterType="hashmap">
		UPDATE uprep_cache_server_registration
		SET    
	        TYPE = #{TYPE} , 
			EXPIRES = #{EXPIRES} ,
			<if test="STORAGE_SIZE != null"> STORAGE_SIZE = #{STORAGE_SIZE} ,</if> 
			MAX_UP_BW = #{MAX_UP_BW} ,
			MAX_DN_BW = #{MAX_DN_BW} ,
			MAX_NUM_CONNECTION = #{MAX_NUM_CONNECTION} ,
			MAX_NUM_OVERLAY_NETWORK = #{MAX_NUM_OVERLAY_NETWORK} ,
			UPDATED_AT = now()
		WHERE  
			RESOURCE_ID = #{RESOURCE_ID}
	</update>
	
	<delete id="DELETE_REGISTRATION" parameterType="hashmap" >
		DELETE FROM 
			uprep_cache_server_registration
		<where>
			<trim prefixOverrides="AND">
				<if test="RESOURCE_ID != null">
					AND RESOURCE_ID = #{RESOURCE_ID}
				</if>
				<if test="OMS_URL != null">
					AND OMS_URL LIKE CONCAT('%',#{OMS_URL},'%')
				</if>
			</trim>
		</where> 
	</delete>
	
</mapper>