<?xml version="1.0" encoding="UTF-8" ?>
<!DOCTYPE mapper
       PUBLIC "-//mybatis.org//DTD Mapper 3.0//EN"
       "http://mybatis.org/dtd/mybatis-3-mapper.dtd">

<mapper namespace="kr.re.etri.uprep">
	
	<select id="SELECT_OMS_ADDRESS" parameterType="hashmap" resultType="hashmap">
		SELECT  
				DISTINCT OMS_ADDRESS
		FROM     
				uprep_channel
		WHERE 
				OMS_ADDRESS IS NOT NULL
	</select>
	
	<select id="SELECT_CHANNEL" parameterType="hashmap" resultType="hashmap">
		SELECT  CHANNEL_ID,
	   			VERSION,                                        
		        TITLE,
		        OWNER_ID,
		        OVERLAY_NETWORK_ID,
                OMS_ADDRESS,
                CLOSED,
                AUTH_KEY,
                PIECE_SIZE,
                CONTENT_TYPE,
                CONTENT_SIZE,
                PIECE_NUM,
                THUMBNAIL_PATH,
                IMAGE_PATH,
		        DATE_FORMAT(CREATED_AT, '%Y-%m-%d %H:%i:%s') CREATED_AT,
		        DATE_FORMAT(UPDATED_AT, '%Y-%m-%d %H:%i:%s') UPDATED_AT          
		                                           
		FROM     
				uprep_channel
		<where>
			<trim prefixOverrides="AND">
				<if test="CHANNEL_ID != null">
					AND CHANNEL_ID = #{CHANNEL_ID}
				</if>
				<if test="OWNER_ID != null">
					AND OWNER_ID LIKE CONCAT('%',#{OWNER_ID},'%')
				</if>
				<if test="OVERLAY_NETWORK_ID != null">
					AND OVERLAY_NETWORK_ID = #{OVERLAY_NETWORK_ID}
				</if>
				<if test="TITLE != null">
					AND TITLE LIKE CONCAT('%',#{TITLE},'%')
				</if>
				<if test="OMS_ADDRESS != null">
					AND OMS_ADDRESS LIKE CONCAT('%',#{OMS_ADDRESS},'%')
				</if>
			</trim>
		</where>
	</select>
	
	<insert id="INSERT_CHANNEL" parameterType="hashmap">
		INSERT INTO uprep_channel
			<trim prefix="(" prefixOverrides="" suffix=")" suffixOverrides=",">
		        CHANNEL_ID,
	   			VERSION,                                        
		        TITLE,
		        OWNER_ID,
		        OVERLAY_NETWORK_ID,
                OMS_ADDRESS,
                CLOSED,
                <if test="AUTH_KEY != null">AUTH_KEY,</if>  
                PIECE_SIZE,
                CONTENT_TYPE,
                <if test="CONTENT_SIZE != null">CONTENT_SIZE,</if>  
                <if test="PIECE_NUM != null">PIECE_NUM,</if>  
		        CREATED_AT
			</trim>
		VALUES
			<trim prefix="(" prefixOverrides="" suffix=")" suffixOverrides=",">
		        #{CHANNEL_ID},
	   			#{VERSION},                                        
		        #{TITLE},
		        #{OWNER_ID},
		        #{OVERLAY_NETWORK_ID},
		        #{OMS_ADDRESS},
		        #{CLOSED},
		        <if test="AUTH_KEY != null">#{AUTH_KEY},</if>  
		        #{PIECE_SIZE},
		        #{CONTENT_TYPE},
		        <if test="CONTENT_SIZE != null">#{CONTENT_SIZE},</if>  
		        <if test="PIECE_NUM != null">#{PIECE_NUM},</if> 
		        now()
			</trim>
	</insert>
	
	<update id ="UPDATE_CHANNEL" parameterType="hashmap">
		UPDATE uprep_channel
		SET    
		       <if test="VERSION != null">VERSION = #{VERSION},</if>
		       <if test="TITLE != null">TITLE = #{TITLE},</if>
  		       <if test="CLOSED != null">CLOSED = #{CLOSED},</if>
  		       <if test="CONTENT_SIZE != null">CONTENT_SIZE = #{CONTENT_SIZE},</if>
  		       <if test="PIECE_NUM != null">PIECE_NUM = #{PIECE_NUM},</if>
		       <if test="THUMBNAIL_PATH != null">THUMBNAIL_PATH = #{THUMBNAIL_PATH},</if>
		       <if test="IMAGE_PATH != null">IMAGE_PATH = #{IMAGE_PATH},</if>
		       UPDATED_AT = now()
		WHERE  
			CHANNEL_ID = #{CHANNEL_ID}
	</update>
	
	<delete id="DELETE_CHANNEL" parameterType="hashmap" >
		DELETE FROM 
			uprep_channel
		WHERE  
			CHANNEL_ID = #{CHANNEL_ID}
	</delete>
	
	<delete id="DELETE_ALL_CHANNEL" parameterType="hashmap" >
		DELETE FROM 
			uprep_channel
		<where>
			<trim prefixOverrides="AND">
				<if test="CHANNEL_ID != null">
					AND CHANNEL_ID = #{CHANNEL_ID}
				</if>
				<if test="OWNER_ID != null">
					AND OWNER_ID LIKE CONCAT('%',#{OWNER_ID},'%')
				</if>
				<if test="OVERLAY_NETWORK_ID != null">
					AND OVERLAY_NETWORK_ID = #{OVERLAY_NETWORK_ID}
				</if>
				<if test="OMS_ADDRESS != null">
					AND OMS_ADDRESS LIKE CONCAT('%',#{OMS_ADDRESS},'%')
				</if>
			</trim>
		</where>
	</delete>
</mapper>