<?xml version="1.0" encoding="UTF-8" ?>
<!DOCTYPE mapper
       PUBLIC "-//mybatis.org//DTD Mapper 3.0//EN"
       "http://mybatis.org/dtd/mybatis-3-mapper.dtd">

<mapper namespace="kr.re.etri.uprep">
	
	<select id="SELECT_RESOURCE_ALLOCATION" parameterType="hashmap" resultType="hashmap">
		SELECT  INDEX_URL,
	   			REQUESTER_PEER_ID,                                        
		        ACTION_TYPE,
		        NOTIFICATION_ADDRESS,
		        STORAGE_SIZE,
		        MAX_UP_BW,
		        MAX_DN_BW,
		        MAX_NUM_CONNECTION,
		        TIMEOUT,
		        MAX_TRAFFIC,
		        NUM_OF_SEEDER,
		        COMPLETE,
		        RESOURCE_ID,
		        VIRTUAL_PEER_ID,
		        RELAY_SESSION_ID,
		        EXPIRES,
		        NETWORK_IP,
		        NETWORK_PORT,
		        LINK,
		        OVERLAY_NETWORK_ID,
		        DATE_FORMAT(CREATED_AT, '%Y-%m-%d %H:%i:%s') CREATED_AT ,
		        DATE_FORMAT(UPDATED_AT, '%Y-%m-%d %H:%i:%s') UPDATED_AT                                   
		FROM     
				uprep_resource_allocation
		<where>
			<trim prefixOverrides="AND">
				<if test="REQUESTER_PEER_ID != null">
					AND REQUESTER_PEER_ID = #{REQUESTER_PEER_ID}
				</if>
				<if test="ACTION_TYPE != null">
					AND ACTION_TYPE = #{ACTION_TYPE}
				</if>
				<if test="RESOURCE_ID != null">
					AND RESOURCE_ID = #{RESOURCE_ID}
				</if>
				<if test="VIRTUAL_PEER_ID != null">
					AND VIRTUAL_PEER_ID = #{VIRTUAL_PEER_ID}
				</if>
				<if test="RELAY_SESSION_ID != null">
					AND RELAY_SESSION_ID = #{RELAY_SESSION_ID}
				</if>
				<if test="INDEX_URL != null">
					AND INDEX_URL LIKE CONCAT('%',#{INDEX_URL},'%')
				</if>
				<if test="OVERLAY_NETWORK_ID != null">
					AND OVERLAY_NETWORK_ID = #{OVERLAY_NETWORK_ID}
				</if>
			</trim>
		</where>
	</select>
	
	<insert id="INSERT_RESOURCE_ALLOCATION" parameterType="hashmap">
		INSERT INTO uprep_resource_allocation
			<trim prefix="(" prefixOverrides="" suffix=")" suffixOverrides=",">
		        <if test="INDEX_URL != null">INDEX_URL,</if>
	   			REQUESTER_PEER_ID,                                        
		        ACTION_TYPE,
		        <if test="NOTIFICATION_ADDRESS != null">NOTIFICATION_ADDRESS,</if>
		        <if test="STORAGE_SIZE != null">STORAGE_SIZE,</if>
		        <if test="MAX_UP_BW != null">MAX_UP_BW,</if>
		        <if test="MAX_DN_BW != null">MAX_DN_BW,</if>
		        <if test="MAX_NUM_CONNECTION != null">MAX_NUM_CONNECTION,</if>
		        <if test="TIMEOUT != null">TIMEOUT,</if>
		        <if test="MAX_TRAFFIC != null">MAX_TRAFFIC,</if>
		        <if test="NUM_OF_SEEDER != null">NUM_OF_SEEDER,</if>
		        <if test="COMPLETE != null">COMPLETE,</if>
		        RESOURCE_ID,
		        <if test="VIRTUAL_PEER_ID != null">VIRTUAL_PEER_ID,</if>
		        <if test="RELAY_SESSION_ID != null">RELAY_SESSION_ID,</if>
		        <if test="EXPIRES != null">EXPIRES,</if>
		        <if test="NETWORK_IP != null">NETWORK_IP,</if>
		        <if test="NETWORK_PORT != null">NETWORK_PORT,</if>
		        <if test="LINK != null">LINK,</if>
		        <if test="OVERLAY_NETWORK_ID != null">OVERLAY_NETWORK_ID,</if>
		        CREATED_AT
			</trim>
		VALUES
			<trim prefix="(" prefixOverrides="" suffix=")" suffixOverrides=",">
		        <if test="INDEX_URL != null">#{INDEX_URL},</if>
	   			#{REQUESTER_PEER_ID},                                        
		        #{ACTION_TYPE},
		        <if test="NOTIFICATION_ADDRESS != null">#{NOTIFICATION_ADDRESS},</if>
		        <if test="STORAGE_SIZE != null">#{STORAGE_SIZE},</if>
		        <if test="MAX_UP_BW != null">#{MAX_UP_BW},</if>
		        <if test="MAX_DN_BW != null">#{MAX_DN_BW},</if>
		        <if test="MAX_NUM_CONNECTION != null">#{MAX_NUM_CONNECTION},</if>
		        <if test="TIMEOUT != null">#{TIMEOUT},</if>
		        <if test="MAX_TRAFFIC != null">#{MAX_TRAFFIC},</if>
		        <if test="NUM_OF_SEEDER != null">#{NUM_OF_SEEDER},</if>
		        <if test="COMPLETE != null">#{COMPLETE},</if>
		        #{RESOURCE_ID},
		        <if test="VIRTUAL_PEER_ID != null">#{VIRTUAL_PEER_ID},</if>
		        <if test="RELAY_SESSION_ID != null">#{RELAY_SESSION_ID},</if>
		        <if test="EXPIRES != null">#{EXPIRES},</if>
		        <if test="NETWORK_IP != null">#{NETWORK_IP},</if>
		        <if test="NETWORK_PORT != null">#{NETWORK_PORT},</if>
		        <if test="LINK != null">#{LINK},</if>
		        <if test="OVERLAY_NETWORK_ID != null">#{OVERLAY_NETWORK_ID},</if>
		        now()
			</trim>
	</insert>
	
	<update id ="UPDATE_RESOURCE_ALLOCATION" parameterType="hashmap">
		UPDATE uprep_resource_allocation
		SET    
		        <if test="STORAGE_SIZE != null">STORAGE_SIZE = #{STORAGE_SIZE},</if>
		        <if test="MAX_UP_BW != null">MAX_UP_BW = #{MAX_UP_BW},</if>
		        <if test="MAX_DN_BW != null">MAX_DN_BW = #{MAX_DN_BW},</if>
		        <if test="MAX_NUM_CONNECTION != null">MAX_NUM_CONNECTION = #{MAX_NUM_CONNECTION},</if>
		        <if test="TIMEOUT != null">TIMEOUT = #{TIMEOUT},</if>
		        <if test="MAX_TRAFFIC != null">MAX_TRAFFIC = #{MAX_TRAFFIC},</if>
		        <if test="NUM_OF_SEEDER != null">NUM_OF_SEEDER = #{NUM_OF_SEEDER},</if>
		        <if test="COMPLETE != null">COMPLETE = #{COMPLETE},</if>
		        UPDATED_AT = now()
		<where>
			<trim prefixOverrides="AND">
				<if test="RESOURCE_ID != null">
					AND RESOURCE_ID = #{RESOURCE_ID}
				</if>
				<if test="VIRTUAL_PEER_ID != null">
					AND VIRTUAL_PEER_ID = #{VIRTUAL_PEER_ID}
				</if>
				<if test="RELAY_SESSION_ID != null">
					AND RELAY_SESSION_ID = #{RELAY_SESSION_ID}
				</if>
			</trim>
		</where>
	</update>
	
	<delete id="DELETE_RESOURCE_ALLOCATION" parameterType="hashmap" >
		DELETE FROM 
			uprep_resource_allocation
		<where>
			<trim prefixOverrides="AND">
				<if test="REQUESTER_PEER_ID != null">
					AND REQUESTER_PEER_ID = #{REQUESTER_PEER_ID}
				</if>
				<if test="RESOURCE_ID != null">
					AND RESOURCE_ID = #{RESOURCE_ID}
				</if>
				<if test="VIRTUAL_PEER_ID != null">
					AND VIRTUAL_PEER_ID = #{VIRTUAL_PEER_ID}
				</if>
				<if test="RELAY_SESSION_ID != null">
					AND RELAY_SESSION_ID = #{RELAY_SESSION_ID}
				</if>
				<if test="OVERLAY_NETWORK_ID != null">
					AND OVERLAY_NETWORK_ID = #{OVERLAY_NETWORK_ID}
				</if>
			</trim>
		</where> 
	</delete>
	
</mapper>