<?xml version="1.0" encoding="UTF-8" ?>
<!DOCTYPE mapper
       PUBLIC "-//mybatis.org//DTD Mapper 3.0//EN"
       "http://mybatis.org/dtd/mybatis-3-mapper.dtd">

<mapper namespace="kr.re.etri.uprep">
	
	<select id="SELECT_FILE" parameterType="hashmap" resultType="hashmap">
		SELECT  FILE_ID,
	   			CHANNEL_ID,                                        
		        FILENAME,
		        FILE_SIZE,
		        DATE_FORMAT(CREATED_AT, '%Y-%m-%d %H:%i:%s') CREATED_AT                                   
		FROM     
				uprep_file
		WHERE
				CHANNEL_ID = #{CHANNEL_ID}
	</select>
	
	<insert id="INSERT_FILE" parameterType="hashmap">
		INSERT INTO uprep_file
			<trim prefix="(" prefixOverrides="" suffix=")" suffixOverrides=",">
		        FILE_ID,
	   			CHANNEL_ID,                                        
		        FILENAME,
		        FILE_SIZE,
		        CREATED_AT
			</trim>
		VALUES
			<trim prefix="(" prefixOverrides="" suffix=")" suffixOverrides=",">
		        #{FILE_ID},
	   			#{CHANNEL_ID},                                        
		        #{FILENAME},
		        #{FILE_SIZE},
		        now()
			</trim>
	</insert>
	
	<update id ="UPDATE_FILE" parameterType="hashmap">
		UPDATE uprep_file
		SET    
		       <if test="CHANNEL_ID != null">CHANNEL_ID = #{CHANNEL_ID},</if>
		       <if test="FILENAME != null">FILENAME = #{FILENAME},</if>
		       <if test="FILE_SIZE != null">FILE_SIZE = #{FILE_SIZE},</if>
		       CREATED_AT = now()
		WHERE  
			CHANNEL_ID = #{CHANNEL_ID}
		AND
			FILE_ID = #{FILE_ID}
	</update>
	
	<delete id="DELETE_FILE" parameterType="hashmap" >
		DELETE FROM 
			uprep_file
		WHERE
				CHANNEL_ID = #{CHANNEL_ID} 
	</delete>
	
	<delete id="DELETE_ALL_FILE" parameterType="hashmap" >
		DELETE FROM 
			uprep_file
		<where>
			<if test="CHANNEL_ID_LIST != null">
			CHANNEL_ID IN
				<foreach collection="CHANNEL_ID_LIST" item="item" separator="," open="(" close=")">
				    #{item}
				</foreach>
			</if>
		</where>
	</delete>
	
</mapper>