<?xml version="1.0" encoding="UTF-8" ?>
<!DOCTYPE mapper
       PUBLIC "-//mybatis.org//DTD Mapper 3.0//EN"
       "http://mybatis.org/dtd/mybatis-3-mapper.dtd">

<mapper namespace="kr.re.etri.uprep">
	
	
	<select id="SELECT_PEER_COUNT" parameterType="hashmap" resultType="hashmap">
		SELECT  COUNT(*) CNT                                   
		FROM     
				uprep_peer
		WHERE
				OVERLAY_NETWORK_ID = #{OVERLAY_NETWORK_ID}
	</select>
	
	<select id="SELECT_PEER" parameterType="hashmap" resultType="hashmap">
		SELECT  PEER_ID,
	   			OVERLAY_NETWORK_ID,                                        
		        IP_ADDRESS,
		        PORT,
		        PUBLIC                                   
		FROM     
				uprep_peer
		<where>
			<trim prefixOverrides="AND">
				<if test="OVERLAY_NETWORK_ID != null">
					AND OVERLAY_NETWORK_ID = #{OVERLAY_NETWORK_ID}
				</if>
				<if test="PEER_ID != null">
					AND PEER_ID = #{PEER_ID}
				</if>
			</trim>
		</where>
	</select>
	
	<insert id="INSERT_PEER" parameterType="hashmap">
		INSERT INTO uprep_peer
			<trim prefix="(" prefixOverrides="" suffix=")" suffixOverrides=",">
		        PEER_ID,
	   			OVERLAY_NETWORK_ID,                                        
		        IP_ADDRESS,
		        PORT,
		        PUBLIC,
		        CREATED_AT
			</trim>
		VALUES
			<trim prefix="(" prefixOverrides="" suffix=")" suffixOverrides=",">
		        #{PEER_ID},
	   			#{OVERLAY_NETWORK_ID},                                        
		        #{IP_ADDRESS},
		        #{PORT},
		        #{PUBLIC},
		        now()
			</trim>
		ON 
			DUPLICATE KEY 
		UPDATE
			IP_ADDRESS = #{IP_ADDRESS} , 
			PORT = #{PORT} , 
			PUBLIC = #{PUBLIC} ,
			UPDATED_AT = now()
	</insert>
	
	<update id ="UPDATE_PEER" parameterType="hashmap">
		UPDATE uprep_peer
		SET    
		       <if test="IP_ADDRESS != null">IP_ADDRESS = #{IP_ADDRESS},</if>
		       <if test="PORT != null">PORT = #{PORT},</if>
		       <if test="PUBLIC != null">PUBLIC = #{PUBLIC},</if>
		       UPDATED_AT = now()
		WHERE  
			OVERLAY_NETWORK_ID = #{OVERLAY_NETWORK_ID}
		AND 
			PEER_ID = #{PEER_ID}
	</update>
	
	<delete id="DELETE_PEER" parameterType="hashmap" >
		DELETE FROM 
			uprep_peer
		<where>
			<trim prefixOverrides="AND">
				<if test="OVERLAY_NETWORK_ID != null">
					AND OVERLAY_NETWORK_ID = #{OVERLAY_NETWORK_ID}
				</if>
				<if test="PEER_ID != null">
					AND PEER_ID = #{PEER_ID}
				</if>
			</trim>
		</where> 
	</delete>
	
	<delete id="DELETE_ALL_PEER" parameterType="hashmap" >
		DELETE FROM 
			uprep_peer
		<where>
			<if test="OVERLAY_ID_LIST != null">
			OVERLAY_NETWORK_ID IN
				<foreach collection="OVERLAY_ID_LIST" item="item" separator="," open="(" close=")">
				    #{item}
				</foreach>
			</if>
		</where>
	</delete>
	
</mapper>